{
  "schema_version": 2,
  "updated_at_utc": "2026-10-26T11:26:10Z",
  "tracks": {
    "grove-basin-jtrsy": {
      "status": "review_required",
      "status_label": "Onchain ramp observed; phase review required",
      "status_detail": "Twelve Grove cBEAM transactions were observed September 3\u201318. Approved key targets changed September 3 and September 17; the historical phase classification has not been re-attested.",
      "current_phase_id": "phase-2",
      "target_phase_id": "phase-3",
      "phase_activations": {
        "phase-2": {
          "source": "BA Labs public phase confirmation"
        },
        "phase-3": {
          "expected_execution_utc": "2026-08-31",
          "source": "August 27 spell schedule",
          "onchain_trigger": {
            "source": "August 27 spell PAS launch event",
            "event_name": "SetHop",
            "source_address": "0x1A1879E66547F90bfF87D45A5b0335950E019E02",
            "not_before_utc": "2026-08-31T00:00:00Z",
            "not_after_utc": "2026-09-01T00:00:00Z",
            "details": {
              "rate_limits": "0x0000000000000000000000000000000000000000",
              "value": 57600
            }
          }
        }
      },
      "operator_changes_authorized": false,
      "operator_note": "Use the separately sourced Target 1 and Target 2 programs for approved key targets. Reconcile the current phase, exposure and CRR requirements before authorizing new dashboard instructions. Execution evidence: https://forum.skyeco.com/t/grove-cbeam-configuration/28216/16",
      "exposure": {
        "observed_usd": 4000000,
        "observed_at_utc": "2026-08-21T07:52:17Z",
        "requirement_verified": true,
        "source": "BA Labs public phase confirmation"
      },
      "qualitative_kpis": []
    },
    "grove-basin-buidl": {
      "status": "paused",
      "status_label": "Paused",
      "status_detail": "A required prerequisite has not been confirmed.",
      "pause_reason": "The required legal documentation has not been confirmed as signed.",
      "current_phase_id": "phase-1",
      "target_phase_id": null,
      "phase_activations": {
        "phase-1": {
          "source": "Team status update"
        }
      },
      "operator_changes_authorized": false,
      "operator_note": "Do not raise rate limits while the instance is paused.",
      "exposure": {
        "observed_usd": 0,
        "observed_at_utc": null,
        "requirement_verified": false,
        "source": "Team status update"
      },
      "qualitative_kpis": [
        {
          "id": "required-prerequisite",
          "label": "Required onboarding prerequisite confirmed",
          "required": true,
          "status": "missing",
          "evidence_url": null
        }
      ]
    },
    "grove-uniswap-v3": {
      "status": "review_required",
      "status_label": "Onchain ramp observed; phase review required",
      "status_detail": "Twelve Grove cBEAM transactions were observed September 3\u201318. Approved key targets changed September 3 and September 17; the historical phase classification has not been re-attested.",
      "current_phase_id": "phase-1",
      "target_phase_id": "phase-2",
      "target_date_utc": "2026-08-31T00:00:00Z",
      "phase_activations": {
        "phase-1": {
          "source": "BA Labs public phase confirmation"
        },
        "phase-2": {
          "expected_execution_utc": "2026-08-31",
          "source": "https://etherscan.io/tx/0x14e1678e7a9b28bb99373e5590e649c23cd9cf26bebb988e211521288e7fa2cf",
          "executed_at_utc": "2026-08-31T14:11:35Z"
        }
      },
      "operator_changes_authorized": false,
      "operator_note": "Use the separately sourced Target 1 and Target 2 programs for approved key targets. Reconcile the current phase, exposure and CRR requirements before authorizing new dashboard instructions. Execution evidence: https://forum.skyeco.com/t/grove-cbeam-configuration/28216/16",
      "exposure": {
        "observed_usd": 1000000,
        "observed_at_utc": "2026-08-21T07:52:17Z",
        "requirement_verified": true,
        "source": "BA Labs public phase confirmation"
      },
      "qualitative_kpis": [
        {"id": "swap-directions", "label": "Both enabled swap directions exercised", "required": true, "status": "complete"},
        {"id": "initial-position", "label": "Initial Uniswap position created", "required": true, "status": "complete"},
        {"id": "partial-removal", "label": "Bounded partial liquidity removal completed", "required": true, "status": "complete"},
        {"id": "complete-exit", "label": "Complete exit path completed", "required": true, "status": "complete"},
        {"id": "exposure-restored", "label": "Required exposure restored", "required": true, "status": "complete"}
      ]
    },
    "grove-usds": {
      "status": "review_required",
      "status_label": "Onchain ramp observed; phase review required",
      "status_detail": "Twelve Grove cBEAM transactions were observed September 3\u201318. Approved key targets changed September 3 and September 17; the historical phase classification has not been re-attested.",
      "current_phase_id": "initial-envelope",
      "target_phase_id": null,
      "operator_changes_authorized": false,
      "operator_note": "Use the separately sourced Target 1 and Target 2 programs for approved key targets. Reconcile the current phase, exposure and CRR requirements before authorizing new dashboard instructions. Execution evidence: https://forum.skyeco.com/t/grove-cbeam-configuration/28216/16",
      "exposure": {"observed_usd": 0, "requirement_verified": true, "source": "Not an exposure-gated track"},
      "qualitative_kpis": []
    },
    "grove-psm": {
      "status": "review_required",
      "status_label": "Onchain ramp observed; phase review required",
      "status_detail": "Twelve Grove cBEAM transactions were observed September 3\u201318. Approved key targets changed September 3 and September 17; the historical phase classification has not been re-attested.",
      "current_phase_id": "initial-envelope",
      "target_phase_id": null,
      "operator_changes_authorized": false,
      "operator_note": "Use the separately sourced Target 1 and Target 2 programs for approved key targets. Reconcile the current phase, exposure and CRR requirements before authorizing new dashboard instructions. Execution evidence: https://forum.skyeco.com/t/grove-cbeam-configuration/28216/16",
      "exposure": {"observed_usd": 0, "requirement_verified": true, "source": "Not an exposure-gated track"},
      "qualitative_kpis": []
    },
    "osero-aave": {
      "status": "needs_confirmation",
      "status_label": "Current phase not confirmed",
      "status_detail": "The live 5 million limits are compatible with Phases 1 through 3 and therefore do not identify the approved phase.",
      "current_phase_id": null,
      "target_phase_id": null,
      "operator_changes_authorized": false,
      "operator_note": "Mint and SparkLend deposit remain 5M capacity / 5M per day. Both PAU changes and core cBEAM activation are proposed for September 24; approved phase and qualitative KPI evidence remain unconfirmed.",
      "exposure": {
        "observed_usd": 0,
        "observed_at_utc": null,
        "requirement_verified": false,
        "source": "No authoritative live phase attestation configured"
      },
      "qualitative_kpis": [
        {"id": "phase-confirmation", "label": "Current phase confirmed by the responsible reviewer", "required": true, "status": "missing"}
      ]
    },
    "osero-usds": {
      "status": "active",
      "status_label": "Initial envelope observed; PAS pending",
      "status_detail": "Live mint remains 5M capacity / 5M per day. Burn is unlimited, consistent with the published September 24 scope.",
      "current_phase_id": "initial-envelope",
      "target_phase_id": null,
      "operator_changes_authorized": false,
      "operator_note": "The proposed September 24 change raises mint to 50M and leaves burn unlimited. Do not mark execution or PAS activation before onchain confirmation.",
      "exposure": {"observed_usd": 0, "requirement_verified": true, "source": "Not an exposure-gated track"},
      "qualitative_kpis": []
    },
    "spark-arbitrum-cctp-v2": {
      "status": "needs_confirmation",
      "status_label": "October 8 spell proposed; execution not confirmed",
      "status_detail": "The new CCTP v2 keys and Arbitrum PAS are not yet confirmed active. Current onchain values appear separately in the live data panel.",
      "current_phase_id": null,
      "target_phase_id": null,
      "operator_changes_authorized": false,
      "operator_note": "No cBEAM increase is authorized. Await risk advisor limit confirmation, PAS deployment, the approved Lindy KPI plan, and executed spell evidence.",
      "exposure": {"observed_usd": 0, "requirement_verified": true, "source": "Capital-flowing route; no outstanding exposure threshold in the draft plan"},
      "qualitative_kpis": [
        {"id": "spell-and-pas-confirmation", "label": "Spell and PAS configuration verified on Arbitrum", "required": true, "status": "missing"},
        {"id": "facet-lindy-kpi-plan", "label": "Facet Lindy KPI plan approved by Dewiz and Sidestream", "required": true, "status": "missing"}
      ]
    },
    "spark-base-cctp-v2": {
      "status": "needs_confirmation",
      "status_label": "Base onboarding and execution unconfirmed",
      "status_detail": "The Base plan inherits initial Arbitrum requirements only. Base onchain activation, approval, and KPI completion require independent evidence.",
      "current_phase_id": null,
      "target_phase_id": null,
      "operator_changes_authorized": false,
      "operator_note": "No cBEAM increase is authorized. Await risk advisor limit confirmation, PAS deployment, the approved Lindy KPI plan, and executed spell evidence.",
      "exposure": {
        "observed_usd": 0,